,Time,Title,URL,Text,Category,Country,Type-Token Ratio,Word Count,Sentence Count,Avg Sentence Length,Avg Num of Words Per Sent
0,13:32:00,Altun: İsrail savaş suçu işliyor,https://anayurtgazetesi.com/haber/17630133/altun-israil-savas-sucu-isliyor,"Cumhurbaşkanlığı İletişim Başkanı Fahrettin Altun, Sakarya Üniversitesi (SAÜ) ve TÜBİTAK işbirliğiyle düzenlenen 3. Uluslararası İletişim Bilimleri Sempozyumu'na (ICOMS) katıldı. 2000'li yıllardan itibaren küreselleşmenin küresel terörizmle, 2010'lardan itibaren küresel finans krizleriyle ve 2020'den itibaren de küresel sağlık ve gıda kriziyle anılmaya başlandığına dikkati çeken Altun, son 3 yıldır önce pandemiyle, ardından Rusya-Ukrayna kriziyle, şimdi de İsrail’in Orta Doğu'nun kalbinde sergilediği barbarlıkla insanlığın, İkinci Dünya Savaşı sonrasında daldığı ""aydınlanma rüyası""ndan uyandığını ve Batılı uluslararası ilişkiler düzeninin dayattığı çözüm önerilerinin sadra şifa olmadığını gördüğünü söyledi. ""Türkiye, istikrarlaştırıcı güç olma çabası içindedir"" Altun, bugün bölge halklarının ve tüm insanlığın en önemli sorunu olan küresel adaletsizliğin kaynağında Batılı sömürge düzeninin bulunduğunu ve bu düzeni ayakta tutan temel dinamiğin ise ""Batıcı bağımlılık sistemi"" olduğunu dile getirdi. ""Türkiye’nin küresel alandaki mücadelesi, bu adaletsizliğe son verme mücadelesidir. Belirsizliklerle, krizlerle kayıtlı bu zor zamanda Türkiye, bir istikrar adası olmanın ötesinde istikrarlaştırıcı güç olma çabası içindedir."" diyen Altun, bu coğrafyanın 2010'lardan itibaren yeni kaosla karşı karşıya kaldığına, ""Arap Baharı"" olarak adlandırılan dalgayla bölgenin istikrarsızlaştırıldığına, terörizmin, fanatizmin, radikalizmin, bölünmüş toplumların, başarısız devletlerin, yeni darbe yöntemlerinin, büyük göç hareketlerinin ve katliamların merkezi haline geldiğine dikkati çekti. Türkiye'nin de bu süreçte çok ağır sınamalarla ve meydan okumalarla karşı karşıya kaldığına işaret eden Altun, son 10 yılda karşı karşıya kalınan dış müdahalelerin, temelde bölgesel güç haline gelmeyi başaran Türkiye’nin küresel aktör olmasını engellemekle ilgili kötücül girişimler olduğunu söyledi. Altun, ""Sokak kalkışmaları, darbe görünümlü işgal girişimi, terör saldırıları ve benzeri dış destekli müdahaleler, doğrudan Türkiye’nin küresel kriz çağında kapasite geliştirmesinin ve iddia sahibi aktör olarak küresel alanda varlık göstermesinin önüne geçmek maksadıyla hayata geçirildi. Ne var ki güçlü siyasal liderlik ve istikrar sayesinde bu dış müdahaleler devre dışı bırakıldı, karşı karşıya kaldığımız sistematik tehditler bertaraf edildi."" diye konuştu. ""Dezenformasyona en fazla maruz kalan ülkelerin başında Türkiye geliyor"" İletişimin, devletler arasında en önemli rekabet alanına dönüştüğüne işaret eden Altun, bu bağlamda yatırım yapılan stratejik alanlardan biri olduğunu ve Türkiye'nin bu rekabette öne çıkmak için alt ve üstyapı yatırımları gerçekleştirdiğini, kamu ve özel sektörün ciddi kapasite geliştirdiğini dile getirdi. Altun, bu yatırım ve geliştirmelerin, dış müdahalelere ve manipülasyonlara açık hale gelmemesi için devletin söylem birliğinin tesisi, dünya kamuoyuna Türkiye'nin tezlerinin en doğru ve hızlı şekilde anlatılması, devlet-millet iletişiminin karşılıklı ve etkin şekilde gerçekleştirilebilmesi ile artan kara propaganda kampanyalarına karşı etkin mücadele verilebilmesi, demokrasiyi, insan haklarını ve bireysel özgürlükleri tehdit eder hale gelen dezenformasyon virüsüne karşı koyma ihtiyacından kaynaklandığı bilgisini paylaştı. Bütün insanlık için sorun olan dezenformasyona en fazla maruz kalan ülkelerin başında Türkiye'nin geldiğine işaret eden Altun, ""Bunun nedeni de elbette Türkiye'nin güçlenmesidir, iddia sahibi olmasıdır ve Batılı sömürge düzenine meydan okumasıdır."" dedi. Altun, ciddiyetle mücadele edilmesi gereken küresel kriz seviyesine erişen dezenformasyonun demokrasiyi yozlaştıran, toplumları belirsizlik sarmalı içinde debelenmeye iten, bireysel hak ve özgürlükleri hedef alan zehirli ve yıkıcı etkilerine karşı tek panzehrin hakikatin kendisi olduğunu dile getirdi. ""Gazze’de ölüm kusan katiller hesap verecekler"" Altun, ""Asrın Felaketi"" olarak nitelendirilen Kahramanmaraş merkezli 6 Şubat'taki depremlerde de dezenformasyonun ne denli tehlikeli sorun olduğunu somut şekilde gördüklerine, o dönem İletişim Başkanlığının yayımladığı bültenlerin kitap hacmine eriştiğine dikkati çekti. Muhteva olarak farklı ancak mahiyet itibarıyla benzer durumun Gazze'de yaşanan insanlık dramında görüldüğüne işaret eden Altun, ""İsrail, bütün dünyanın gözleri önünde savaş suçu işliyor. İsrail, faşizmin ve ırkçı emperyalizmin en çirkin, en vahşi örneklerini sergiliyor. Unutmayalım ki 20. yüzyılın ilk yarısında Avrupa’nın ortasında milyonlarca insan, resmi devlet görevlileri tarafından toplama kamplarında, ölüm odalarında katledildi. O caniler unutulmadı, o gün bugün kendilerine lanet ediliyor. Bugünün canileri de unutulmayacaklar. Gazze’de ölüm kusan katiller hesap verecekler. Nasıl ki maşeri vicdanda mahkum edildiler, aynı şekilde küresel adalet nizamı tesis edildiği vakit gerçek mahkemeler tarafından da mahkum edilecekler."" diye konuştu. Altun, İsrail'in aleni savaş suçu işleyerek sürdürdüğü katliamlarla eş zamanlı şekilde kirli dezenformasyon kampanyası da yürüttüğünü belirterek, şunları kaydetti: ""İsrail, sürdürdüğü zalim saldırılarla bir şehri, bir beldeyi enkaza çevirmek ve yaşanmaz hale getirmek istediği gibi hakikat sahasında da bir enkazla, harabeyle bizi baş başa bırakmaya çalışıyor. İsrail, Filistinli, Gazzeli çocuklara, kadınlara, erkeklere, yaşlılara, gazetecilere, sağlık çalışanlarına, kısaca masumlara yönelik katliamlarını sistematik dezenformasyon kampanyalarıyla adeta meşrulaştırmaya, görünmez kılmaya çalışıyor. İstiyorlar ki insanlık, dünya kamuoyu, İsrail’e hak vermese dahi en azından ses çıkarmadan bu zulmü sessizce izlesin. İstiyorlar ki herkes, yalanlarla ve dezenformasyon içerikli haberlerin oluşturduğu gündemle meşgul olsun ve Gazze’de yürek parçalayan feryatları duymasın.""",top,turkey,0.6136919315403423,818,26,31.46153846153846,25.889
1,14:10:20,"UEFA ve FIFA, İsrail'in Gazze'deki saldırıları karşısında sessiz",https://www.korkusuz.com.tr/uefa-ve-fifa-israil-in-gazze-deki-saldirilari-karsisinda-sessiz-p2635,"Uluslararası Futbol Federasyonları Birliği (FIFA) ve Avrupa Futbol Federasyonları Birliğinin (UEFA), 38 gündür Gazze'ye yönelik saldırılarda bulunan İsrail'e herhangi bir yaptırım uygulamaması dikkati çekti. Rusya'yı, geçen yıl 24 Şubat'ta başlayan Ukrayna'ya karşı saldırısının henüz ilk günlerinde, sivil ölümlerini gerekçe göstererek tüm turnuvalardan men eden UEFA ve FIFA, İsrail'e karşı ise sessiz kaldı. UEFA'dan ilk açıklama, Rusya Devlet Başkanı Vladimir Putin'in, askeri operasyona başladıklarını duyurmasından yaklaşık 5 saat sonra geldi. Açıklamada, ""Uluslararası toplumda, Avrupa'nın güvenliği konusunda endişeler bulunmaktadır. Ukrayna'da devam eden Rus askeri saldırısını şiddetle kınıyoruz. UEFA, olimpik ruha uygun, barış ve insan haklarına saygı gibi Avrupa'nın ortak değerleri çerçevesinde futbolu geliştirmek için çalışmaktadır."" ifadeleri kullanıldı. 27 Şubat'ta Birleşmiş Milletler, Rusya'nın saldırılarında 64 sivilin öldüğünü, 176 kişinin de yaralandığını duyurdu. Aynı saatlerde toplanan FIFA yönetimi ise Ukrayna'ya askeri müdahalede bulunan Rusya'da uluslararası futbol maçlarının oynanmayacağını, karşılaşmalarda Rusya bayrağı ve marşının kullanılmayacağını açıkladı. Şiddetin asla çözüm olmadığının belirtildiği açıklamada ""Barışın acilen tesis edilmesi ve yapıcı diyaloğun başlaması için çağrıda bulunuyoruz."" denildi. Bu karardan bir gün sonra (28 Şubat), yani saldırıların 4. gününde FIFA ve UEFA, Rus kulüpleri ve milli takımlarının organizasyonlarına katılımını askıya aldı. Rus takımları, o günden bu yana uluslararası alanda müsabakalara katılamadı. Rusya'nın Ukrayna'ya saldırısında olimpik ruh, barış ve insan haklarına saygı kavramlarıyla ilk günden harekete geçen ve 4. günde yaptırım uygulayan UEFA ile FIFA, 38 gündür devam eden Gazze'deki saldırılar için herhangi bir yaptırım kararı almadı. UEFA ve FIFA; ibadethaneleri, okulları ve hastaneleri bombalayan, 7 bini çocuk 11 bini aşkın insanın hayatını kaybetmesine neden olan İsrail'i görmezden geldi. İsrail'in, 500 kişinin vefat ettiği 17 Ekim'deki El-Ehli Baptist Hastanesi'ni bombalaması dünyanın dört bir yanında protesto edilirken, savaş suçu niteliğindeki bu saldırıda bile UEFA ve FIFA kınama mesajı dahi yayımlamadı. Aynı kurumlar, bu saldırıdan sadece bir gün önce 2024 Avrupa Futbol Şampiyonası Elemeleri'nde Belçika ile İsveç arasında oynanan karşılaşma sırasında Brüksel'de yapılan silahlı saldırıda ölen 2 kişi için derhal kınama mesajı yayımlarken, o hafta oynanan maçlarda saygı duruşunda bulunma kararı aldı. UEFA ve FIFA, önce İsrail'in milli takım ve kulüp takımlarının oynaması gereken tüm uluslararası maçları erteledi. Akabinde İsrail'in talebi doğrultusunda, ülkede oynanması gereken müsabakalar, yine İsrail'in belirlediği başka ülkelere alındı. Buna göre milli takım için Macaristan, kulüp takımlarından Maccabi Tel Aviv için Sırbistan ve Maccabi Haifa için Kıbrıs Rum Kesimi tayin edildi. Bu karar alınırken diğer takımların fikstürü ve yerel lig maçları dikkate alınmadı. İsrail'in ertelenen Kosova maçı, geçen hafta sonu yapıldı ve yerel liglerde maçların devam ettiği dönemde milli maç oynatıldı. İsrail'in, 7 Ekim'de Hamas'ın silahlı kanadı İzzeddin el-Kassam Tugayları'nın saldırılarında hayatını kaybedenler için 2024 Avrupa Şampiyonası Elemeleri'nde bu hafta oynayacağı İsviçre ve Romanya maçlarında saygı duruşunda bulunulması talebi, UEFA tarafından kabul edildi. Buna göre İsrail'in yarın ve 18 Kasım'da Macaristan'da yapacağı bu iki karşılaşmada saygı duruşunda bulunulacak. İsrail Futbol Federasyonu Başkanı Shino Zoertz, UEFA'nın söz konusu kararıyla ilgili yaptığı açıklamada, Filistinlileri ""insan pislikleri"" şeklinde niteleyerek 7 Ekim'i hatırlattı ve şu ifadeleri kullandı: ""Bir dakikalık saygı duruşu, İsrail Milli Takımı'nın herkese bu insanlık suçunu hatırlatmanın yollarından sadece bir tanesi. Kaçırılan kişiler sorununu vurgulamak ve geri dönüşlerine yardımcı olacak gücümüzün olduğuna inanmak için çeşitli kanallar aracılığıyla çalışıyoruz. Öldürülenlerin anısını en saygılı şekilde onurlandıracağız."" 38 gündür İsrail'in saldırılarına maruz kalan Filistin'de, futbol milli takımının 2026 Dünya Kupası Elemeleri takviminde, bir hafta içinde iki maçı bulunuyor. Fikstüre göre Filistin Milli Takımı'nın, 16 Kasım Perşembe günü Lübnan ile Birleşik Arap Emirlikleri'nde, 21 Kasım Salı günü de Avustralya ile Kuveyt'te maçları var. Söz konusu müsabakalar için şu ana dek bir erteleme kararı/açıklaması bulunmuyor. An itibarıyla Filistin Milli Takımı da Ürdün'de bulunuyor. Futbolda yaklaşık iki yıl önce Rus takımları için verilen men kararı, basketbolda da uygulanmıştı. Uluslararası Basketbol Federasyonu (FIBA) ve Avrupa Basketbol Ligleri Birliği (ULEB), insan hakları, olimpik ruh, fair play ve barış kelimelerini içeren cümlelerle Rus takımlarının uluslararası müsabakalara katılımını durdurmuştu. Aynı kurumlar, Gazze'ye yönelik saldırılarının ardından ise İsrail takımları için herhangi bir yaptırımda bulunmazken, ULEB'in organize ettiği Avrupa Ligi organizasyonunun sitesinden ""12-13 Ekim'de yapılacak 2. hafta maçları öncesinde, İsrail'deki terör saldırılarında hayatını kaybedenlerin onuruna saygı duruşunda bulunulacaktır"" şeklinde açıklama yapıldı. Daha sonra bu açıklama, ""Orta Doğu'daki üzücü olaylar sebebiyle"" ibaresiyle revize edildi. FIBA ve ULEB, 38 gündür devam eden İsrail saldırılarına karşı ise kınama dahi yayımlamadı. İsrail basketbol takımlarının maçları ertelenirken, bu ekipler için fikstür de değiştirildi. (AA)",top,turkey,0.5652173913043478,805,36,22.36111111111111,18.919
2,20:46:00,"İzzeddin el-Kassam Tugayları, İsrail tanklarına düzenlediği saldırılara ait görüntüleri yayınladı",https://www.haber16.com/izzeddin-el-kassam-tugaylari-israil-tanklarina-duzenledigi-saldirilara-ait-goruntuleri-yayinladi/1292118/,"Hamas'ın silahlı kanadı İzzeddin el-Kassam Tugayları, Gazze şehrinde kara operasyonu yürüten İsrail birliklerine ait tanklara düzenlediği roket saldırılarına ait yeni görüntüler yayınladı.İzzeddin el-Kassam Tugayları, Gazze Şeridi'nde kara harekatına devam eden İsrail güçlerine karşılık vermeyi sürdürüyor. İzzeddin el-Kassam Tugayları, Gazze şehrinde kara operasyonu yürüten İsrail birliklerine ait tanklara düzenlediği roket saldırılarına ait yeni görüntüler yayınladı. Düzenlenen saldırılarda çok sayıda zırhlı aracın imha edildiği açıklandı. İHA",world,turkey,0.5512820512820513,78,5,15.6,13.6
3,09:34:00,Bahçeli'den İmamoğlu'na sert sözler: Evine göndereceğiz,http://www.turktime.com/haber/bahceli-den-imamoglu-na-sert-sozler-evine-gonderecegiz/668467,"MHP Genel Başkanı Devlet Bahçeli, partisinin TBMM'deki grup toplantısında açıklamalarda bulundu. Sizleri hürmet ve muhabbetle selamlıyorum. Bugünkü toplantımızı takip eden vatandaşlarımıza selamlarımı iletiyorum Laf değil iş üretiyoruz. İşleyen demirin pas tutmayacağını biliyoruz. Milletimize hizmeti var oluşumuzun özü olarak nitelendiriyoruz. Gönül vermedikçe gönül bulamayacağımızın farkındayız. Milliyetçi Hareket Partisi olarak ülkemize gönül verdik. Hiç kimseyi öteki görmüyoruz ötekileştirmiyoruz. 31 Mart 2024 tarihinde yapılacak mahalli idareler seçimi hazırlık sürecini dolu dolu geçireceğiz. Merkezi yönetimle yerel yönetimler tek ses tek yürek olacak. Belediye kaynaklarını bölücülere sevk edilenlerden milletimiz mutlaka hesap soracak. İsrail askerleri bebek, kadın, yaşlı demeden katliam gerçekleştiriyor. Netanyahu katliamları aralıksız sürdürme mesajı verdi. İsrail aciz ve korkaktır. Hastane bahçesine füze atılması da vahşettir. İsrail'in attığı füzenin ABD envanterinde bulunması da ortaklığın kanıtıdır. Biden'ın inandırıcılığı yoktur. Öte yandan Filistinliler de zorla yerinde edilmek isteniyor. Gazze konusunda herkes sussa da biz susmayacağız. Sessiz kalmayacağız. İlk olarak İsrail ile Filistin arasındaki çatışmaların durması ve insani yardım koridorlarının açılması şarttır. Derhal ateşkes sağlanmalıdır. Biz dünyaya hilalin nurundan bakıyoruz. Filistin'in arkasında dağ gibi duruyoruz. Hem Türk hem de Müslüman'ız. AB komisyonu raporunu yırtıp atıyor veya kağıttan uçak yapıp kendilerine aynen iade ediyoruz. Hukuk toplumun genel çıkarlarını sağlamak için yasaların tamamıdır. Hukuk adalete yönelmiş toplumsal hayatın denge ve düzenidir. Asıl olan adalettir. Hukuk adaletin vasıtasıdır. AYM ile Yargıtay arasındaki anlaşmazlık hukuk devleti açısından arzu etmediğimiz durumdur. Pek çok lütuf doğacaktır. Görüş ayrılıkları, yorum farkları içtihat zenginliklerini tahkim edecektir. Eleştiriler, öneriler, derinlikli düşünceler milletin egemenlik çıkarlarını gözeten çıkarımlar hukukun üstünlüğünü güçlendirecek. Suç duyurusuna varan süreç devlet veya rejim krizi değildir. Kriz bekleyenlere, kriz ayini yapanlar avuçlarını yalayacak, hevesleri kursaklarında kalacak. AYM hukuk düzeninin safrası ve sancısıdır. AYM'nin bireysel başvurularda hukuk düzenin tahrip edecek kararlar alması, sürüklenme halidir. Yasa koyucunun hükümlerini yok sayması vakayi hayriyeden sapma halidir. TİP'ten Hatay Milletvekili seçilen ve Gezi Parkı davasından kesinleşen 18 yıl cezası bulunan Can Atalay'ın başvurusunun 3 ay gibi kısa sürede sonuçlandırılması, HDP'nin kapatma davasında aynı hassasiyetin niye gösterilmediği akıllara gelmiştir. Yargıya saygı mecburidir. Bu kararın gereği TBMM'de derhal yapılmalı ve konu kapatılmalıdır. Anayasa Mahkemesi ile Yargıtay arasında hiyerarşik bir düzen yoktur. Anayasa Mahkemesi'nin millet vicdanına ihlal kararları yeniden yargılama sebebidir. Gazi Meclis Anayasa Mahkemesi'nin vesayeti altında değildir. Milletin üstünde bir güç olamaz. TBMM'de oturma eylemi yapan güruhun Yargıtay'a laf etmesi küstahlıktır. Oturanlara sesleniyorum, siz oturmaya devam edin, Türk milleti size Osmanlı şamarını vura vura 31 Mart'ta kaldırmasını da bilecek.",top,turkey,0.7807606263982103,447,48,9.3125,7.898
4,06:44:43,Kuşatma altındaki Şifa Hastanesi'nde bebekler ölümle burun buruna! Vücut ısılarını sağlamak için folyoya sardılar,https://www.haberler.com/dunya/kusatma-altindaki-sifa-hastanesi-nde-bebekler-16530516-haberi/,"Gazze'de 11 binden fazla Filistinliyi katleden İsrail'in kuşatma altına aldığı Şifa Hastanesi'nde insanlık dramı yaşanıyor. Bölgenin en büyük hastanesi olan Şifa Hastanesi'nin işlevini kaybetmesi sonucunda bebekler ilkel yollarla hayatta tutulmaya çalışılıyor. Yenidoğan ünitesinde ısı için folyo kullanılıyor. Hamas'ın 7 Ekim sabahı başlattığı Aksa Tufanı operasyonuna karşılık veren İsrail , Gazze 'ye 39 gündür bomba üstüne bomba yağdırıyor. 11 binden fazla Filistinliyi katleden İsrail ordusu, bölgenin en büyük hastanesi olan Şifa'yı ise dört bir yandan kuşatma altına almış durumda. Elektrikleri kesilen ve işlevini tamamen kaybeden hastanedeki çok sayıda bebek ise ilkel yollarla hayatta tutulmaya başlandı. GAZZE'DE TEMEL İHTİYAÇLAR KARŞILANAMAZ DURUMDA İsrail'in Gazze 'ye yönelik soykırım niteliğini taşıyan saldırıları 39'uncu gününde devam ediyor. Bölgede hayat durma noktasına gelirken, temel ihtiyaçlar karşılanamaz durumda. Öyle ki bombardıman sonucunda yaralanan kişilerin tedavi görebileceği hastane bile saldırı altında. Bölgede sağlık sistemi yerle bir olurken, yaralılar bahçelerde tedavi edilmeye çalışılıyor. DÜNYA SAĞLIK ÖRGÜTÜ: ŞİFA HASTANESİ'NDE DURUM OLDUKÇA VAHİM Dünya Sağlık Örgütü Genel Direktörü, bölgenin en büyüğü olan Şifa Hastanesi hakkında açıklamalarda bulundu. Durumu ""korkunç ve tehlikeli"" olarak nitelendiren Direktör, ""Güvenli bir sığınak olması gereken hastanelerin ölüm, yıkım ve umutsuzluk sahnelerine dönüşmesine dünya sessiz kalamaz."" dedi. Bir diğer yandan hastanede elektrik yetersizliği nedeni ile 6 bebeğin hayatını kaybettiği de biliniyor. BEBEKLERİ ÖLMEMELERİ İÇİN FOLYOLARA SARIYORLAR Hastane işlevini kaybederken yenidoğan ünitesindeki bebeklerin hayatı da tehlikede. Doktorlar, imkansızlıklara karşı savaşırken, bebekleri ölmemeleri için folyolara sarıyor. Ayrıca folyoya sarılan bebeklerin yanına sıcak su bırakılarak ısılarını korumaları sağlanmaya çalışılıyor. Bir diğer yandan oksijen kalmaması sebebiyle bebeklerin kuvözlerden çıkarıldığı belirtildi. ""HAYATLARI TEHLİKE ALTINDA OLAN 33 PREMATÜRE BEBEK VAR"" İsrail'in yakıt girişine izin vermemesi neticesinde bu ölümlerin yaşandığına dikkati çeken Ebu Silmiyye, hastanede hayatları tehlike altında olan 33 prematüre bebeğin daha bulunduğunu söyledi. Ebu Silmiyye, hastaneye sağlanan 300 litre yakıtın reddedildiği iddialarına ilişkin ise ""Yalan ve iftiradan ibaret."" ifadesini kullanarak, İsrail'in teklif ettiği yakıtın ""hastanenin jeneratörlerini yalnızca 15 dakika çalıştırabileceğini"" söyledi. ŞİFA HASTANESİ DOKTORU: BEBEKLER BİRER BİRER ÖLÜYOR İsrail'in füze, roket ve uçaklarla saldırı düzenlediği Şifa Hastanesi'nde görev yapan doktor Fadya Malhis ise yaşanan çaresizliği şu sözlerle ifade etti; ""İsrail hastanenin oksijen merkezini de vurdu. Kuvözdeki bebekler birer birer ölüyor. Doktorları çok hedef aldılar. Arkadaşlarımız şehit oldu. 4 günden beri kimse çıkamıyor. Pencereden bile bakan hemşire vuruldu. Kim hareket ediyorsa onu vuruyorlar. Doktorlar hastaneden ne çıkabiliyor, ne de dışardakiler hastaneye girebiliyor. Şehitlerimizi bile alamıyoruz. Küçüçük bir odada karanlıkta oturuyoruz, kimse hareket etmiyor. Allah'a sığındık."" AL-AMAL HASTANESİ'NİN 24 SAATLİK ENERJİSİ KALDI Gazze Şeridi'nde Han Yunus bölgesinde Filistin Kızılayı'nın kontrolünde bulunan Al-Amal hastanesinde elektriği sağlayan jeneratörün yakıtının 24 saat içinde biteceği ifade edildi. Filistin Kızılayı'ndan yapılan açıklamada, ""Han Yunus'taki Filistin Kızılayı'na bağlı Al-Amal hastanesinin tek elektrik jeneratörü çalışmayı durdurdu. Bu durum, 25'i tıbbi rehabilitasyon bölümünde olmak üzere tedavi gören ve her an ölüm riskiyle karşı karşıya olan 90 hastanın hayatını tehdit ediyor. Hastane şu anda sadece doğum bölümüne ve acil durum aydınlatmasına elektrik sağlayan çok küçük bir jeneratöre bağlı durumda. Kalan yakıtın önümüzdeki 24 saat içinde tükenmesinin beklendiğini belirtmek isteriz"" denildi. İKİ BÜYÜK HASTANE HİZMET DIŞI KALMIŞTI Gazze 'deki en büyük hastane olan Şifa hastanesi ve Al Quds hastanesi, yakıt yetersizliği nedeniyle hizmet dışı kaldı. Filistin merkezli sağlık kuruluşları ve uluslararası kuruluşlar, on binlerce hasta, sağlık görevlisi ve yerinden edilmiş sivilin bu hastanelere sığındığını açıklamıştı. Öte yandan hastane civarına yapılan hava saldırıları ve İsrail ordusundan kara kuvvetlerinin hastanelerin etrafını sarması, sivillerin bölgeden tahliye edilmesini zorlaştırıyor. Filistin Kızılayı, hastanenin bulunduğu bölgede yoğun çatışmaların yaşandığını, sağlık ekipleri ve hastaların binada mahsur kaldığını duyurmuştu. İSRAİL'İN GAZZE'YE SALDIRILARINDA SON DURUM Hamas'ın silahlı kanadı İzzeddin el-Kassam Tugayları, 7 Ekim sabahı, İsrail'in ""Filistinlilere ve başta Mescid-i Aksa olmak üzere kutsal değerlerine yönelik sürekli ihlallerine karşılık verme"" gerekçesiyle kapsamlı saldırı düzenlerken, İsrail ordusu da Gazze Şeridi'ne yoğun hava bombardımanı başlattı. İsrail, 7 Ekim'den bu yana 46'sı Gazze Şeridi içindeki çatışmalarda, 6'sı kuzeyde Lübnan sınırında olmak üzere 365'i asker 1200'den fazla İsraillinin öldüğünü, 5 bin 132 kişinin yaralandığını duyurdu. İsrail'e göre, Kassam Tugayları'nın elinde 239 İsrailli esir bulunuyor. Gazze'deki hükümete göre ölenlerin sayısı 11 bin 240'ı aştı, bu kişilerin en az 4 bin 630'unu çocuklar ve 3 bin 130'unu kadınlar oluşturuyor. Batı Şeria ve Kudüs'te de İsrail güçleri ve Yahudi yerleşimciler, 193 Filistinliyi öldürdü. İsrail ordusu, Gazze'de on binlerce yaralı ile sivilin sığındığı onlarca hastaneyi zorla tahliye ettirmek için yerleşkelerini ya da ana binalarını vurdu. Saldırılarda yüzlerce kişi öldü ve yaralandı. İsrail ordusu ile Hizbullah arasında 8 Ekim'den bu yana yaşanan çatışmalarda 74 Hizbullah mensubu öldü. Filistin İsrail Gazze Sağlık Yaşam Dünya Güncel Haberler",top,turkey,0.6382211538461539,832,47,17.70212765957447,13.345
