139,14:10:20,"UEFA ve FIFA, İsrail'in Gazze'deki saldırıları karşısında sessiz",https://www.korkusuz.com.tr/uefa-ve-fifa-israil-in-gazze-deki-saldirilari-karsisinda-sessiz-p2635,"Uluslararası Futbol Federasyonları Birliği (FIFA) ve Avrupa Futbol Federasyonları Birliğinin (UEFA), 38 gündür Gazze'ye yönelik saldırılarda bulunan İsrail'e herhangi bir yaptırım uygulamaması dikkati çekti. Rusya'yı, geçen yıl 24 Şubat'ta başlayan Ukrayna'ya karşı saldırısının henüz ilk günlerinde, sivil ölümlerini gerekçe göstererek tüm turnuvalardan men eden UEFA ve FIFA, İsrail'e karşı ise sessiz kaldı. UEFA'dan ilk açıklama, Rusya Devlet Başkanı Vladimir Putin'in, askeri operasyona başladıklarını duyurmasından yaklaşık 5 saat sonra geldi. Açıklamada, ""Uluslararası toplumda, Avrupa'nın güvenliği konusunda endişeler bulunmaktadır. Ukrayna'da devam eden Rus askeri saldırısını şiddetle kınıyoruz. UEFA, olimpik ruha uygun, barış ve insan haklarına saygı gibi Avrupa'nın ortak değerleri çerçevesinde futbolu geliştirmek için çalışmaktadır."" ifadeleri kullanıldı. 27 Şubat'ta Birleşmiş Milletler, Rusya'nın saldırılarında 64 sivilin öldüğünü, 176 kişinin de yaralandığını duyurdu. Aynı saatlerde toplanan FIFA yönetimi ise Ukrayna'ya askeri müdahalede bulunan Rusya'da uluslararası futbol maçlarının oynanmayacağını, karşılaşmalarda Rusya bayrağı ve marşının kullanılmayacağını açıkladı. Şiddetin asla çözüm olmadığının belirtildiği açıklamada ""Barışın acilen tesis edilmesi ve yapıcı diyaloğun başlaması için çağrıda bulunuyoruz."" denildi. Bu karardan bir gün sonra (28 Şubat), yani saldırıların 4. gününde FIFA ve UEFA, Rus kulüpleri ve milli takımlarının organizasyonlarına katılımını askıya aldı. Rus takımları, o günden bu yana uluslararası alanda müsabakalara katılamadı. Rusya'nın Ukrayna'ya saldırısında olimpik ruh, barış ve insan haklarına saygı kavramlarıyla ilk günden harekete geçen ve 4. günde yaptırım uygulayan UEFA ile FIFA, 38 gündür devam eden Gazze'deki saldırılar için herhangi bir yaptırım kararı almadı. UEFA ve FIFA; ibadethaneleri, okulları ve hastaneleri bombalayan, 7 bini çocuk 11 bini aşkın insanın hayatını kaybetmesine neden olan İsrail'i görmezden geldi. İsrail'in, 500 kişinin vefat ettiği 17 Ekim'deki El-Ehli Baptist Hastanesi'ni bombalaması dünyanın dört bir yanında protesto edilirken, savaş suçu niteliğindeki bu saldırıda bile UEFA ve FIFA kınama mesajı dahi yayımlamadı. Aynı kurumlar, bu saldırıdan sadece bir gün önce 2024 Avrupa Futbol Şampiyonası Elemeleri'nde Belçika ile İsveç arasında oynanan karşılaşma sırasında Brüksel'de yapılan silahlı saldırıda ölen 2 kişi için derhal kınama mesajı yayımlarken, o hafta oynanan maçlarda saygı duruşunda bulunma kararı aldı. UEFA ve FIFA, önce İsrail'in milli takım ve kulüp takımlarının oynaması gereken tüm uluslararası maçları erteledi. Akabinde İsrail'in talebi doğrultusunda, ülkede oynanması gereken müsabakalar, yine İsrail'in belirlediği başka ülkelere alındı. Buna göre milli takım için Macaristan, kulüp takımlarından Maccabi Tel Aviv için Sırbistan ve Maccabi Haifa için Kıbrıs Rum Kesimi tayin edildi. Bu karar alınırken diğer takımların fikstürü ve yerel lig maçları dikkate alınmadı. İsrail'in ertelenen Kosova maçı, geçen hafta sonu yapıldı ve yerel liglerde maçların devam ettiği dönemde milli maç oynatıldı. İsrail'in, 7 Ekim'de Hamas'ın silahlı kanadı İzzeddin el-Kassam Tugayları'nın saldırılarında hayatını kaybedenler için 2024 Avrupa Şampiyonası Elemeleri'nde bu hafta oynayacağı İsviçre ve Romanya maçlarında saygı duruşunda bulunulması talebi, UEFA tarafından kabul edildi. Buna göre İsrail'in yarın ve 18 Kasım'da Macaristan'da yapacağı bu iki karşılaşmada saygı duruşunda bulunulacak. İsrail Futbol Federasyonu Başkanı Shino Zoertz, UEFA'nın söz konusu kararıyla ilgili yaptığı açıklamada, Filistinlileri ""insan pislikleri"" şeklinde niteleyerek 7 Ekim'i hatırlattı ve şu ifadeleri kullandı: ""Bir dakikalık saygı duruşu, İsrail Milli Takımı'nın herkese bu insanlık suçunu hatırlatmanın yollarından sadece bir tanesi. Kaçırılan kişiler sorununu vurgulamak ve geri dönüşlerine yardımcı olacak gücümüzün olduğuna inanmak için çeşitli kanallar aracılığıyla çalışıyoruz. Öldürülenlerin anısını en saygılı şekilde onurlandıracağız."" 38 gündür İsrail'in saldırılarına maruz kalan Filistin'de, futbol milli takımının 2026 Dünya Kupası Elemeleri takviminde, bir hafta içinde iki maçı bulunuyor. Fikstüre göre Filistin Milli Takımı'nın, 16 Kasım Perşembe günü Lübnan ile Birleşik Arap Emirlikleri'nde, 21 Kasım Salı günü de Avustralya ile Kuveyt'te maçları var. Söz konusu müsabakalar için şu ana dek bir erteleme kararı/açıklaması bulunmuyor. An itibarıyla Filistin Milli Takımı da Ürdün'de bulunuyor. Futbolda yaklaşık iki yıl önce Rus takımları için verilen men kararı, basketbolda da uygulanmıştı. Uluslararası Basketbol Federasyonu (FIBA) ve Avrupa Basketbol Ligleri Birliği (ULEB), insan hakları, olimpik ruh, fair play ve barış kelimelerini içeren cümlelerle Rus takımlarının uluslararası müsabakalara katılımını durdurmuştu. Aynı kurumlar, Gazze'ye yönelik saldırılarının ardından ise İsrail takımları için herhangi bir yaptırımda bulunmazken, ULEB'in organize ettiği Avrupa Ligi organizasyonunun sitesinden ""12-13 Ekim'de yapılacak 2. hafta maçları öncesinde, İsrail'deki terör saldırılarında hayatını kaybedenlerin onuruna saygı duruşunda bulunulacaktır"" şeklinde açıklama yapıldı. Daha sonra bu açıklama, ""Orta Doğu'daki üzücü olaylar sebebiyle"" ibaresiyle revize edildi. FIBA ve ULEB, 38 gündür devam eden İsrail saldırılarına karşı ise kınama dahi yayımlamadı. İsrail basketbol takımlarının maçları ertelenirken, bu ekipler için fikstür de değiştirildi. (AA)",top,turkey,0.5652173913043478,805,36,22.36111111111111,18.919
140,20:19:31,Hamas&apos;tan İsrail&apos;e 5 Günlük Ateşkes Teklifi: &quot;70 Rehineyi Bırakmaya Hazırız&quot;,https://onedio.com/haber/hamas-tan-israil-e-5-gunluk-ateskes-teklifi-70-rehineyi-birakmaya-haziriz-1185366,"Hamas'ın 7 Ekim saldırılarından bugüne İsrail'in Gazze'ye saldırıları şiddetini artırarak devam ediyor. Hamas'ın Kassam Tugayları Sözcüsü Ebu Ubeyde, devam eden çatışmalara 5 gün süreyle ara verilmesi çağrısında bulundu. Ebu Ubeyde, 5 günlük ateşkes karşılığında 70 İsrailli kadın ve çocuk rehineyi serbest bırakacaklarını açıkladı. İsrail ile yapılacak ateşkes çağrısının, Gazze'ye yapılacak insani yardımların güvenliğini de içerdiğini belirten Ebu Ubeyde, ateşkes için hazır olduklarını söyledi. İsrail'in Gazze saldırıları ise tüm şiddetiyle devam ediyor. İsrail, Gazze'deki Cibaliya mülteci kampını vurdu. İsrail'in daha önce de saldırdığı kampta çok sayıda ölü ve yaralının olduğu bildirildi. İsrail'in 7 Ekim'den bu yana düzenlediği saldırılarda 11 bin 180 kişi hayatını kaybetti. Hayatını kaybedenlerin 4 bin 609'u çocuk, 3 bin 100'ü ise kadınlardan oluşuyor.",top,turkey,0.7076923076923077,130,9,14.444444444444445,12.778
141,21:00:00,"Hacı Gaydan: İsrail’in, ‘İbrahimi anlaşmaları’ tuzağı!",https://www.yenimesaj.com.tr/israilin-ibrahimi-anlasmalari-tuzagi-H1506332.htm,"Kurulduğu günden beri sinsi planlar peşinde koşan terör devleti İsrail'in, en son sahneye koyduğu diplomasi kılıflı, bubi tuzaklı anlaşmanın adıdır ""İbrahimi anlaşması."" ABD'nin Kudüs'ü İsrail'in başkenti olarak tanıması ile en azından uyanabilirdi İslam dünyası ama nerede!.. (adsbygoogle = window.adsbygoogle || []).push({}); Bu karar, Arap dünyası açısından Filistin davasını kayıp bir dava, hatta kadük bir daha noktasına taşımıştır. Yine ABD'nin iknasıyla birçok Arap devletinin İbrahim anlaşmalarını tıpış tıpış kabul etmesi, Filistin davasının sonuna gelindiğinin adeta işaret fişeği oldu. Filistinliler, İsrail maharetiyle Ortadoğu'da kendi davalarını savunacak devletlerden birer birer koparıldılar. (adsbygoogle = window.adsbygoogle || []).push({}); Hamas ve İslami Cihat gibi yapılar, aslında Arap devletlerinin bıraktığı boşluğu doldurmaya soyundular. Yine ABD ürünü olan El Kaide, Taliban ve IŞİD ile batı dünyasında İslam düşmanlığı yaratırken, Hamas ve İslami Cihat üzerinden ise Filistin düşmanlığı oluşturuldu. (adsbygoogle = window.adsbygoogle || []).push({}); Hepsi aynı eller tarafından organize ediliyor ve bu planların sonunda, ""Büyük İsrail Devleti""nin kurulması amaçlanıyordu. Hamas ve İslami Cihat'ın tüm meşru müdafaa hakkından kaynaklı eylemler, dünya kamuoyuna İslam terörü etiketiyle servis edildi. Kimler tarafından, Siyonist derin eller tarafından. Geçmişte Filistinlilerin en ateşli savunucuları olan bölgedeki Arap devletler, İsrail'in ortaya koyduğu iyi bir mühendislik çalışması sonucunda, bir andan Filistin davasından uzaklaşmaya başladılar. Mısır, Ürdün, Lübnan, Suriye, Libya, Irak gibi ülkeler, Ortadoğu'da büyük bir boşluk oluşturdular. İşte bu boşluğu, kimi zaman devlet görüntüsü vermeye çalışan Hamas, İslami Cihat ve Hizbullah gibi yapılar doldurmaya çalıştı. Arkalarına Filistin sorununu dışlamış batılı ülkeleri alan İsrail ve ABD, Hamas, İslami Cihat ve işe karışırsa Hizbullah'ı yok etme hazırlığını yapıyor. Ama Hizbullah'ın tüm gücüyle gireceği bir savaşın, kolay kolay bitmeyeceği de daha önceki denemelerden öngörülebiliyor. Birleşmiş Milletler savaş hukukuna göre, savaşın sivillerin yaşadığı alanlara taşınmaması kuralı, tümüyle İsrail ve batılı ülkeler tarafından çöpe atılmış oldu. Artık BM'nin hiçbir hükmü ve işlevi kalmamıştır. Daha da doğrusu, BM'de tıpkı diğer kurumlar gibi, İsrail'in kurulması ve korunması için kurulmuştur. Gazze Şeridi'ni Hamas ve İslami Cihat güçlerinden temizleyip, geride kalacak sivil halkı itaate mecbur kılmanın hesabını yapan İsrail, eğer bunu başarırsa bir sonraki adımı da, Batı Şeria'yı ilhak etmek olacaktır. Bu büyük fotoğrafa bakıldığında, tüm bu hesapların gelip bağlandığı bir başka noktayı daha görmekteyiz. O da, bir İsrail tuzağı olan ve adına da 'İbrahimi Anlaşmalar' denilen, Hint-Pasifik Bölgesi'ni Orta Doğu ve Avrupa'ya bağlayacak olan, çok uluslu bir demir yolu ve denizcilik projesi olarak tanıtılan, Hindistan-Orta Doğu-Avrupa Ekonomik Koridorudur. Eski Baharat Yolu'na benzetilen proje, Hindistan'ın Mumbai kentinden başlayıp, deniz yoluyla Birleşik Arap Emirlikleri'nin Dubai limanına, oradan da demir yoluyla Al Gheweifat bölgesine ulaşıyor. Daha sonra Suudi Arabistan'dan geçerek Ürdün'e, oradan da İsrail'in liman kenti Hayfa'ya uzanıyor. Hayfa'dan deniz yoluyla Yunanistan'ın Pire Limanı'na götürülecek ürünlerin, buradan da kara yoluyla Avrupa'ya taşınması öngörülüyor. Bu zorlama ve içerisi tuzaklarla dolu anlaşma yoluyla, Çin'in 'Kuşak Yol Projesi'ne de büyük bir darbe indirilmiş olacak. Sadece İsrail ve ABD değil BAE, Ürdün ve Suudi Arabistan da, Hamas ve İslami Cihat'ın Gazze Şeridi'ndeki hakimiyetinin, Hindistan-Orta Doğu-Avrupa Ekonomik Koridorunu rahatsız etmesini istemiyorlar. Çok ilginç değil mi? Müslüman ülkelerle Hıristiyan dünyası bir olmuş, bir avuç toprağa ve nüfusa sahip Gazze'yi haritadan silmeye çalışıyor! İşte bu zorlama koridor, Avrupa ve ABD tarafından, Hindistan ön plana çıkartılarak, aslında Çin'in Kuşak Yol projesine karşı planlandığı çok net olarak ortaya dökülmüş oluyor. Hedef, Çin'in ekonomik gücünü kırmak ve 'Kuşak Yol projesi' kapsamındaki Türkiye, İran, Rusya gibi ülkeleri de etkisizleştirmektir. Tam da bu noktadan ve günümüz İslam dünyasının sessizliği üzerinden olaya bakacak olursak, Hindistan-Orta Doğu-Avrupa Ekonomik Koridorunda yer alan Birleşik Arap Emirlikleri, Suudi Arabistan, Ürdün gibi ülkelerin, İsrail ile neden normalleştiklerini daha iyi anlayabiliriz. Çünkü İsrail, bu projede Avrupa'ya geçişteki en önemli ayak. Sadece İsrail ve ABD değil, BAE, Ürdün ve Suudi Arabistan da Hamas ve İslami Cihat'ın, Gazze Şeridi'ndeki hakimiyetinin, Hindistan-Orta Doğu-Avrupa Ekonomik Koridorunu rahatsız etmesini istemiyorlar. Kısacası ekonomik çıkarlarını gözeten birçok Arap ülkesi, Filistin sorunu yükünden de kurtulmanın derdine düşmüş durumda. Ne kadar da vahim ve acı bir tablo var karşımızda. İsrail açısından bir başka önemli neden ise, Gazze kıyılarındaki çok zengin doğal gaz rezervleri. İsrail, 2014'de keşfettiği bu rezervleri sorunsuz bir şekilde Avrupa'ya satmak istiyor. İsrail'in 2014 yazındaki büyük Gazze operasyonunun nedeninin, Gazze açıklarındaki doğal gaz rezervleri olduğu, belgeleriyle ortada durmaktadır. Hamas ve İslami Cihat'ın bitirilmesi zorunluğunun önemli nedenlerinden birisi de işte bu olağanüstü yeraltı kaynaklarının yutulmak istenmesidir. Çünkü Gazze'de oluşacak bir Filistin yönetimi ya da özerk bölgesi, Gazze kıyılarındaki doğal gaz rezervlerinin zenginliğinden doğal olarak pay isteyecektir. Bu da İsrail'in asla kabul etmeyeceği bir gelişmedir. Bu konu uzun uzadıya ve derinlemesine analiz yapılabilecek, çok zengin bir altyapıya sahiptir. Sonuç olarak bugün yaşanmakta olan bu büyük insanlık trajedisi ve İsrail'in yaptığı soykırım eyleminden dolayı en çok etkilenenler, günahsız ve masum çocuklar, kadınlar ve gençler olmaktadır. Bütün bu olan bitenlerin karşısında dünyanın ve hatta İslam âleminin ne yaptığı çok önemli değildir. Bu coğrafyanın asıl sahipleri olan Türk'ler ve Türkiye'nin ne yaptığı çok daha fazla önem taşımaktadır. Peki, yapılan şey nedir? Soykırıma karşı, mitinglerde şiir okumak! Evet, maalesef yapılan ve ortada duran gerçek tam olarak budur. Allah Türk milletini ayıktırsın ve korusun.",top,turkey,0.5357142857142857,980,49,20.0,17.104
142,20:37:12,"AB: Gazze, İsrail tarafından işgal edilemez",https://www.bursadabugun.com/haber/ab-gazze-israil-tarafindan-isgal-edilemez-1658213.html,"Avrupa Birliği (AB) Dış İlişkiler ve Güvenlik Politikası Yüksek Temsilcisi Josep Borrell, Filistinliler için yeni bir devlet inşa edilmesi gerektiğini belirterek, Filistinlilerin sürgününe ve Gazze'nin İsrail tarafından işgaline izin verilemeyeceğini söyledi. Avrupa Birliği Yüksek Temsilcisi Josep Borrell, AB Dışişleri Bakanları Toplantısı'nın ardından İsrail'in Gazze'ye yönelik saldırılarına ilişkin dikkat çeken açıklamalarda bulundu. Bugünkü toplantıda, Gazze'ye insani yardımların acilen ulaştırılması ihtiyacı üzerinde durduklarını aktaran Borrell, ayrıca çatışma bittikten sonra neler yapılacağına, olası senaryolara ilişkin görüşmeler yaptıklarını dile getirdi. Borrell, sözlerini şöyle sürdürdü: ""Filistinliler ile İsrailliler arasında ve bölgede barış için çözüm bulmalıyız. Bugün yaşadığımız dramatik kriz ve hem İsrail hem Filistin tarafındaki çok büyük can kayıpları, uluslararası camianın siyasi ve ahlaki olarak başarısızlığını gösteriyor. Bir çözüm bulmakta başarısız olduk. Bu durum nedeniyle şimdi herkesin çözüm ihtiyacının vazgeçilmez olduğunu anlaması lazım. Çözüm de iki devletli bir gelecek olmalı."" Gazze'nin yeniden inşasının yetmeyeceğini vurgulayan Borrell, şu ifadeleri kullandı: ""Filistinliler için yeni bir devlet inşa etmeliyiz. Bu da çatışmanın sonrası bakmamız gerektiği anlamına geliyor. Arap ülkeleri, şu anda bunu konuşmak istemiyor, onlar bugünü konuşmak istiyor. Çözüm için parametreleri belirlemeliyiz. Bugün bakanlara bunun için şartları içeren bir çerçeve sundum. Bakanlar, bu yaklaşımı destekledi. ABD ve Arap ülkeleriyle birlikte acilen bu çerçeve üzerinde çalışmalıyız."" ""GAZZE TOPRAKLARI, İSRAİL TARAFINDAN İŞGAL EDİLEMEZ"" Borrell, AB olarak 3 konuya ""hayır"" dediklerini aktararak, bunları şöyle sıraladı: ""Birincisi, Gazze'nin dışına zorla göçe izin verilemez. Filistinlilerin sürgün edilmesine izin veremeyiz. İkincisi, Gazze toprakları küçültülemez. Gazze toprakları, İsrail tarafından işgal edilemez. Üçüncüsü ise Gazze'deki durum, Filistin meselesinin çözümünün bir parçası olmak zorunda."" ""MEŞRUİYETİ OLAN TEK FİLİSTİN YÖNETİMİ GEREKLİ"" Borrell, Filistin meselesinin çözümü için ""meşruiyeti olan tek bir Filistin yönetimi"" bulunması, bunun da Birleşmiş Milletler (BM) Güvenlik Konseyince kabul edilmesi gerektiğini söyledi. ""Şu anda bir Filistin yönetimi var. Yeni bir Filistin yönetimi icat etmeyeceğiz."" diyen Borrell, mevcut Filistin yönetiminin güçlendirilmesi gerektiğini bildirdi. Borrell, Gazze'nin Hamas'ın elinde olmasını istemediklerini, ""bir çeşit"" Filistin yönetiminin Gazze'de müdahil olması gerekeceğini kaydederek, ""Bunu nasıl yapacağız, kimse bilmiyor çünkü bu çatışmanın ne zaman biteceğini kimse bilmiyor."" dedi. Bu Filistin yönetimine Arap ülkelerinin güçlü destek vermesi gerektiğinin altını çizen Borrell, Arap ülkeleri müdahil olmadan, yeniden inşaya yardım etmeden, Filistin devletinin oluşumuna siyasi katkı vermeden bir çözümün mümkün olamayacağını dile getirdi. Borrell ayrıca AB'nin bölgede yeterince bulunmadığını, çözüme mutlaka müdahil olması gerektiğini ifade etti. AB, ERMENİSTAN'A VİZE SERBESTİSİNİ DEĞERLENDİRECEK Bugünkü toplantıda, Azerbaycan-Ermenistan konusunu da ele aldıklarını aktaran Borrell, AB'nin Ermenistan'daki misyonunu daha fazla personel ve sınırdaki hassas bölgelerde daha fazla devriye ile artırmayı kararlaştırdıkları bilgisini verdi. Borrell, Ermenistan'a mali destek ve vize serbestisi sağlanması seçeneklerini değerlendireceklerini, iki ülke arasındaki barış müzakerelerinin devamı için çağrıda bulunduklarını, bir sonraki AB Dışişleri Bakanları Toplantısı'na Ermenistan Dışişleri Bakanı'nı davet etmeyi kararlaştırdıklarını kaydetti. Bursa Büyükşehir Belediyespor, Armada Praxis Yalıkavak'a mağlup oldu Bursa'da park halindeki araç alev aldı! Niğde'de inşaatın asansör boşluğunda cansız beden bulundu! Galatasaray Benfica basketbol maçı saat kaçta, hangi kanalda?",top,turkey,0.6213768115942029,552,30,18.4,14.5
143,07:38:00,Siyonist milyarderler imaj düzeltmek için devrede! İsrail kirli planı devreye soktu,https://www.ortadogugazetesi.com/siyonist-milyarderler-imaj-duzeltmek-icin-devrede,"İsrail ordusunun abluka altındaki Gazze Şeridi'ne 7 Ekim'den bu yana düzenlediği saldırılar hız kesmeden devam ederken İsrail, yerle bir olan ı için sosyal ağlardan sonra ana akım medyayı da karartma planını devreye soktu.50'e yakın siyonist milyarderin İsrail yanlısı haberler yaptırmak adına ve basınına akıtacakları öğrenildi. Gazze'de çocuk, kadın demeden binlerce Filistinliyi öldüren Tel Aviv yönetimi, yerle yeksan olan imajının daha da kötüleşmemesi için sosyal ağlara yoğun bir baskı yapıyor. Başta Instagram ve Facebook olmak üzere birçok sosyal medya sitesi İsrail'in katliamlarını sansürlüyor. Uzmanlara göre İsrail Dışişleri Bakanlığı, ABD merkezli arama motoru Google'a da propaganda yaymak için para ödüyor. Son olarak ABD'deki Semafor adlı site, İsrail yanlısı milyarderlerin ana akım medyaya yönelik kirli planını deşifre etti. Buna göre Amerikalı milyarder Barry Sternlicht ile emlak kralı ve yatırımcı Bill Ackman'ın başlattığı kampanyada siyonist milyarderler dünyada yükselen Filistin yanlısı protestolar karşısında zorlanan İsrail'in imajını düzeltmeye çalışacak. Kampanya kapsamında medya, finans ve teknoloji alanında dünyanın en büyük onlarca isminden milyon dolarlık bağış talep edildi. Gazze'de yapılan soykırımı aklamak için 'Barış İçin Gerçekler' adlı medya kampanyası için 50'den fazla kişiden yardım toplanacak. Sürece dahil olan İsrail yanlısı 50 milyarderin toplam servetlerinin 500 milyar dolar olduğu belirtildi.",world,turkey,0.7718446601941747,206,9,22.88888888888889,19.1
144,21:00:00,Aziz Karaca: Gazze harab olduktan sonra…,https://www.yenimesaj.com.tr/gazze-harab-olduktan-sonra-H1506333.htm,"40 günden sonra günaydın demek lazım. İslam İşbirliği Teşkilatı ve Arap Ligi denilen kuruluşlar, Gazze'nin yakılıp yıkılmasından sonra, içinde yaşayan kadın, çoluk-çocuk demeden, hareket eden her ne varsa yerle bir edildikten sonra lütfedip toplandılar. (adsbygoogle = window.adsbygoogle || []).push({}); Dile kolay 40 gün… Gecesi belli değil, gündüzü belli değil aralıksız kırk gündür tepelerinden aşağı bomba yağıyor, havadan uçaklarla yerden tank ve toplarla eşi benzeri görülmemiş bir vahşet sergileniyor. Ayakta kalabilen bir bina, bir ev, bir apartman bir tarafa, çaresiz insanların çaresiz sığındıkları kamp alanları, hastaneler, okullar, camiler ve kiliseler dahi özellikle hedef alınarak insafsızca vuruluyor. (adsbygoogle = window.adsbygoogle || []).push({}); Aralıksız devam eden vahşet görüntüleri kırkıncı gününe yaklaşmışken, adına İslam ülkeleri dedikleri ülkeler güya Gazze gündemi ile toplandılar ve çay kahve faslından ve aile fotoğrafı çektirdikten sonra dağıldılar. Sadra şifa bir karar alındı mı, vahşeti durduracak bir adım atıldı mı, Gazze'deki kadınların ve çocukların feryadını durduracak, dindirecek bir yaptırım kararına varıldı mı? (adsbygoogle = window.adsbygoogle || []).push({}); Yok, yok, yok… Türkiye de dahil olmak üzere hepsinin katil İsrail ile yaptıkları anlaşmalara aynen devam, ticari ilişkilere aynen devam, İsrail'in Gazze'yi bombalayan uçaklarına, toplarına ve tanklarına yakıt temin etmeye aynen devam. Sözü geçen kuruluşlara üye ülkelerin çoğunda, daha önce planlanmış olan eğlence programları bile iptal edilmedi, diğer ülkelerden hiçbiri de demedi ki; ""böyle ortamda, Gazze'de Müslümanların cesetlerini kan seli götürürken bari bunu yapmayın."" Hiçbiri kaşlarını çatıp, suratlarını asıp: ""Irzımızdır çiğnenen, evladımızdır doğranan, Hey sıkılmaz, ağlamazsan bari gülmekten utan"" diyemedi. Demeye ne gerek var? Zere kadar aklı, iz'anı, idraki ve vicdanı olan herkes bilir ki, kardeşlerin başından aşağı bomba yağarken böle şeyler yapılmaz, insan olanın biraz yüzü kızarır. Gazze harab olduktan sonra lütfen toplandılar, çay-kahve faslından sonra dağıldılar. Az o tarafta dehşet devam ediyor, vahşet devam ediyor.",top,turkey,0.6438356164383562,365,14,26.071428571428573,20.429
145,08:24:00,255 terör mensubu yakalandı,https://www.trthaber.com/haber/gundem/255-teror-mensubu-yakalandi-812294.html,"Bakanlığın sosyal medya hesabından Jandarma Genel Komutanlığı Terörle Mücadele Daire Başkanlığı koordinesinde, terör örgütlerinin faaliyetlerinin engellenmesi ve finans kaynaklarının engellenmesi kapsamında operasyonlar düzenlendiği belirtildi. Buna göre, bölücü terör örgütüne yönelik 21 ilde 41 şüpheli, DEAŞ'a yönelik 13 ilde 19 şüpheli, FETÖ'ye yönelik 20 ilde 40 şüpheli, sol terör örgütlerine yönelik 45 ilde 131 şüpheli ve terörizmin finansmanına yönelik 5 ilde 24 şüpheli yakalandı. Ayrıca sosyal medya hesapları üzerinden terör örgütlerini övücü paylaşımlarda bulunduğu tespit edilen 22 ildeki 38 şüpheli hakkında adli işlem başlatıldı. Bakanlık açıklamasında, ""Kahraman jandarmalarımızı tebrik ediyoruz. Allah ayaklarına taş değdirmesin. Hangi terör örgütü olduğu farketmeksizin mücadelemiz yılmadan devam edecek"" denildi.",top,turkey,0.7350427350427351,117,6,19.5,20.6
